{
  "$schema": "https://json-schema.org/draft/2020-12/schema",
  "$id": "story-1.1.schema.json",
  "type": "object",
  "required": ["schemaVersion", "id", "title", "states"],
  "properties": {
    "schemaVersion": { "const": "1.1" },
    "id": { "type": "string" },
    "title": { "type": "string" },
    "states": { "type": "array", "minItems": 1, "items": { "type": "object" } }
  },
  "additionalProperties": false
}
